question,summary_answer,difficulty,text,id
NLG evaluation metrics examples,"It details various metrics from the NLG field, emphasizing fluency, coherence, and specific metrics tailored for tasks like translation and summarization.",intermediate,"Generation Capability
AI was used to generate open-ended outputs long before generative AI
became a thing. For decades, the brightest minds in NLP (natural language
processing) have been working on how to evaluate the quality of open-
ended outputs. The subfield that studies open-ended text generation is
called NLG (natural language generation). NLG tasks in the early 2010s
included translation, summarization, and paraphrasing.
Metrics used to evaluate the quality of generated texts back then included
fluency and coherence. Fluency measures whether the text is grammatically
correct and natural-sounding (does this sound like something written by a
fluent speaker?). Coherence measures how well-structured the whole text is
(does it follow a logical structure?). Each task might also have its own
metrics. For example, a metric a translation task might use is faithfulness:
how faithful is the generated translation to the original sentence? A metric
that a summarization task might use is relevance: does the summary focus
on the most important aspects of the source document? (Li et al., 2022).
Some early NLG metrics, including faithfulness and relevance, have been
repurposed, with significant modifications, to evaluate the outputs of
foundation models. As generative models improved, many issues of early
NLG systems went away, and the metrics used to track these issues became
less important. In the 2010s, generated texts didn’t sound natural. They
were typically full of grammatical errors and awkward sentences. Fluency",cabaa12d
open source vs commercial AI models,"The text outlines the differences between open source models and commercial models, noting that many developers release weaker models openly while keeping stronger models behind paywalls.",beginner,"After developing a model, a developer can choose to open source it, make it
accessible via an API, or both. Many model developers are also model
service providers. Cohere and Mistral open source some models and
provide APIs for some. OpenAI is typically known for their commercial
models, but they’ve also open sourced models (GPT-2, CLIP). Typically,
model providers open source weaker models and keep their best models
behind paywalls, either via APIs or to power their products.
Model APIs can be available through model providers (such as OpenAI and
Anthropic), cloud service providers (such as Azure and GCP [Google Cloud
Platform]), or third-party API providers (such as Databricks Mosaic,
Anyscale, etc.). The same model can be available through different APIs
with different features, constraints, and pricings. For example, GPT-4 is
available through both OpenAI and Azure APIs. There might be slight
differences in the performance of the same model provided through
different APIs, as different APIs might use different techniques to optimize
this model, so make sure to run thorough tests when you switch between
model APIs.
Commercial models are only accessible via APIs licensed by the model
13
developers. Open source models can be supported by any API provider,
allowing you to pick and choose the provider that works best for you. For
commercial model providers, models are their competitive advantages. For
API providers that don’t have their own models, APIs are their competitive",a5d55c7e
evaluating AI with multiple-choice questions,"It describes how non-coding abilities can be assessed using close-ended tasks, particularly multiple-choice questions, which simplify verification and consistency in evaluation.",expert,"efficiency, which is measured by comparing the runtime of the generated
query with the runtime of the ground truth SQL query.
You might also care about code readability. If the generated code runs but
nobody can understand it, it will be challenging to maintain the code or
incorporate it into a system. There’s no obvious way to evaluate code
readability exactly, so you might have to rely on subjective evaluation, such
as using AI judges.
Non-coding domain capabilities are often evaluated with close-ended tasks,
such as multiple-choice questions. Close-ended outputs are easier to verify
and reproduce. For example, if you want to evaluate a model’s ability to do
math, an open-ended approach is to ask the model to generate the solution
to a given problem. A close-ended approach is to give the model several
options and let it pick the correct one. If the expected answer is option C
and the model outputs option A, the model is wrong.
This is the approach that most public benchmarks follow. In April 2024,
75% of the tasks in Eleuther’s lm-evaluation-harness are multiple-choice,
including UC Berkeley’s MMLU (2020), Microsoft’s AGIEval (2023), and
the AI2 Reasoning Challenge (ARC-C) (2018). In their paper, AGIEval’s
authors explained that they excluded open-ended tasks on purpose to avoid
inconsistent assessment.
Here’s an example of a multiple-choice question in the MMLU benchmark:",9a42b3d7
how to set metrics for chatbot evaluation,"The chapter suggests determining a usefulness threshold for evaluation metrics, like a factual consistency score, to assess a chatbot's effectiveness before engaging users.",beginner,"It’s also helpful to determine the usefulness threshold: what scores must an
application achieve for it to be useful? For example, you might determine
that your chatbot’s factual consistency score must be at least 50% for it to
be useful. Anything below this makes it unusable even for general customer
requests.
Before developing AI evaluation metrics, it’s crucial to first understand the
business metrics you’re targeting. Many applications focus on stickiness
metrics, such as daily, weekly, or monthly active users (DAU, WAU,
MAU). Others prioritize engagement metrics, like the number of
conversations a user initiates per month or the duration of each visit—the
longer a user stays on the app, the less likely they are to leave. Choosing
which metrics to prioritize can feel like balancing profits with social
responsibility. While an emphasis on stickiness and engagement metrics can
lead to higher revenues, it may also cause a product to prioritize addictive
features or extreme content, which can be detrimental to users.
Step 3. Define Evaluation Methods and Data
Now that you’ve developed your criteria and scoring rubrics, let’s define
what methods and data you want to use to evaluate your application.",f196fff2
how to detect data contamination in AI models,"The chapter explains that data contamination can be detected using heuristics like n-gram overlapping and perplexity, which help identify if a model has seen evaluation samples during training.",beginner,"to evaluate it on contaminated benchmarks, but this might still be the right
thing to do.
Handling data contamination
The prevalence of data contamination undermines the trustworthiness of
evaluation benchmarks. Just because a model can achieve high performance
on bar exams doesn’t mean it’s good at giving legal advice. It could just be
that this model has been trained on many bar exam questions.
To deal with data contamination, you first need to detect the contamination,
and then decontaminate your data. You can detect contamination using
heuristics like n-gram overlapping and perplexity:
N-gram overlapping
For example, if a sequence of 13 tokens in an evaluation sample is
also in the training data, the model has likely seen this evaluation
sample during training. This evaluation sample is considered dirty.
Perplexity
Recall that perplexity measures how difficult it is for a model to
predict a given text. If a model’s perplexity on evaluation data is
unusually low, meaning the model can easily predict the text, it’s
possible that the model has seen this data before during training.",4098d776
