question,summary_answer,difficulty,text,id
what are open weights in AI models?,"Open weights refer to model weights that are publicly available, without necessarily providing access to the training data, which can be vital for auditing and ethical considerations.",beginner,"model. Some use cases also required access to the training data for auditing
purposes, for example, to make sure that the model wasn’t trained on
10
compromised or illegally acquired data.
To signal whether the data is also open, the term “open weight” is used for
models that don’t come with open data, whereas the term “open model” is
used for models that come with open data.
NOTE
Some people argue that the term open source should be reserved only for fully open models. In this
book, for simplicity, I use open source to refer to all models whose weights are made public,
regardless of their training data’s availability and licenses.
As of this writing, the vast majority of open source models are open weight
only. Model developers might hide training data information on purpose, as
this information can open model developers to public scrutiny and potential
lawsuits.
Another important attribute of open source models is their licenses. Before
foundation models, the open source world was confusing enough, with so
many different licenses, such as MIT (Massachusetts Institute of
Technology), Apache 2.0, GNU General Public License (GPL), BSD
(Berkely Software Distribution), Creative Commons, etc. Open source
models made the licensing situation worse. Many models are released under
their own unique licenses. For example, Meta released Llama 2 under the",cb153bba
how to evaluate generated text quality,"The chapter outlines key evaluation metrics for generated text quality including fluency, coherence, and task-specific measures like faithfulness and relevance.",beginner,"Generation Capability
AI was used to generate open-ended outputs long before generative AI
became a thing. For decades, the brightest minds in NLP (natural language
processing) have been working on how to evaluate the quality of open-
ended outputs. The subfield that studies open-ended text generation is
called NLG (natural language generation). NLG tasks in the early 2010s
included translation, summarization, and paraphrasing.
Metrics used to evaluate the quality of generated texts back then included
fluency and coherence. Fluency measures whether the text is grammatically
correct and natural-sounding (does this sound like something written by a
fluent speaker?). Coherence measures how well-structured the whole text is
(does it follow a logical structure?). Each task might also have its own
metrics. For example, a metric a translation task might use is faithfulness:
how faithful is the generated translation to the original sentence? A metric
that a summarization task might use is relevance: does the summary focus
on the most important aspects of the source document? (Li et al., 2022).
Some early NLG metrics, including faithfulness and relevance, have been
repurposed, with significant modifications, to evaluate the outputs of
foundation models. As generative models improved, many issues of early
NLG systems went away, and the metrics used to track these issues became
less important. In the 2010s, generated texts didn’t sound natural. They
were typically full of grammatical errors and awkward sentences. Fluency",b8627175
how to reduce latency when using AI models,"You can manage latency by optimizing prompts for conciseness, setting stopping conditions for generation, and employing other optimization techniques discussed in previous chapters.",intermediate,"Latency depends not only on the underlying model but also on each prompt
and sampling variables. Autoregressive language models typically generate
outputs token by token. The more tokens it has to generate, the higher the
total latency. You can control the total latency observed by users by careful
prompting, such as instructing the model to be concise, setting a stopping
condition for generation (discussed in Chapter 2), or other optimization
techniques (discussed in Chapter 9).
TIP
When evaluating models based on latency, it’s important to differentiate between the must-have and
the nice-to-have. If you ask users if they want lower latency, nobody will ever say no. But high
latency is often an annoyance, not a deal breaker.
If you use model APIs, they typically charge by tokens. The more input and
output tokens you use, the more expensive it is. Many applications then try
to reduce the input and output token count to manage cost.
If you host your own models, your cost, outside engineering cost, is
compute. To make the most out of the machines they have, many people
choose the largest models that can fit their machines. For example, GPUs
usually come with 16 GB, 24 GB, 48 GB, and 80 GB of memory.
Therefore, many popular models are those that max out these memory
configurations. It’s not a coincidence that many models today have 7 billion
or 65 billion parameters.",b9617461
why do monopolies harm consumers?,"Monopolies lead to increased prices and reduced output, which results in a loss of consumer surplus as noted in option D of the question.",beginner,"Question: One of the reasons that the government discourages and
regulates monopolies is that
(A) Producer surplus is lost and consumer surplus is gained.
(B) Monopoly prices ensure productive efficiency but cost society
allocative efficiency.
(C) Monopoly firms do not engage in significant research and
development.
(D) Consumer surplus is lost with higher prices and lower levels of
output.
Label: (D)
A multiple-choice question (MCQ) might have one or more correct
answers. A common metric is accuracy—how many questions the model
gets right. Some tasks use a point system to grade a model’s performance—
harder questions are worth more points. You can also use a point system
when there are multiple correct options. A model gets one point for each
option it gets right.
Classification is a special case of multiple choice where the choices are the
same for all questions. For example, for a tweet sentiment classification
task, each question has the same three choices: NEGATIVE, POSITIVE,
and NEUTRAL. Metrics for classification tasks, other than accuracy,
include F1 scores, precision, and recall.",9a4bcdf3
How does data lineage affect AI model development?,"Data lineage influences decisions about adopting open source versus proprietary models, alongside navigating copyright concerns related to data usage in AI training.",expert,"15
company’s secrets. It’s unclear how Samsung discovered this leak and
how the leaked information was used against Samsung. However, the
incident was serious enough for Samsung to ban ChatGPT in May 2023.
Some countries have laws that forbid sending certain data outside their
borders. If a model API provider wants to serve these use cases, they will
have to set up servers in these countries.
If you use a model API, there’s a risk that the API provider will use your
data to train its models. Even though most model API providers claim they
don’t do that, their policies can change. In August 2023, Zoom faced a
backlash after people found out the company had quietly changed its terms
of service to let Zoom use users’ service-generated data, including product
usage data and diagnostics data, to train its AI models.
What’s the problem with people using your data to train their models?
While research in this area is still sparse, some studies suggest that AI
models can memorize their training samples. For example, it’s been found
that Hugging Face’s StarCoder model memorizes 8% of its training set.
These memorized samples can be accidentally leaked to users or
intentionally exploited by bad actors, as demonstrated in Chapter 5.
Data lineage and copyright
Data lineage and copyright concerns can steer a company in many
directions: toward open source models, toward proprietary models, or away",624fdda5
open source vs proprietary model performance,"The chapter outlines that while the performance gap between open source models and proprietary models is decreasing, strong proprietary models are likely to remain superior. Open source models may still be viable for many applications despite this lag.",beginner,"Figure 4-7. The gap between open source models and proprietary models is decreasing on the
MMLU benchmark. Image by Maxime Labonne.
For this reason, it’s likely that the strongest open source model will lag
behind the strongest proprietary models for the foreseeable future.
However, for many use cases that don’t need the strongest models, open
source models might be sufficient.
Another reason that might cause open source models to lag behind is that
open source developers don’t receive feedback from users to improve their
models, the way commercial models do. Once a model is open sourced,
model developers have no idea how the model is being used, and how well
the model works in the wild.",249f08da
techniques for detecting factual inconsistency in language models,"The chapter introduces various techniques developed to detect factual inconsistency, while noting that comprehensive coverage of these methods is beyond the scope of the chapter.",expert,"techniques used to measure these qualities can give you a rough idea of how
to evaluate other qualities you care about.
Factual consistency
Due to factual inconsistency’s potential for catastrophic consequences,
many techniques have been and will be developed to detect and measure it.
It’s impossible to cover them all in one chapter, so I’ll go over only the
broad strokes.
The factual consistency of a model’s output can be verified under two
settings: against explicitly provided facts (context) or against open
knowledge:
Local factual consistency
The output is evaluated against a context. The output is considered
factually consistent if it’s supported by the given context. For
example, if the model outputs “the sky is blue” and the given context
says that the sky is purple, this output is considered factually
inconsistent. Conversely, given this context, if the model outputs “the
sky is purple”, this output is factually consistent.
Local factual consistency is important for tasks with limited scopes
such as summarization (the summary should be consistent with the
original document), customer support chatbots (the chatbot’s
responses should be consistent with the company’s policies), and",7f0e2336
What are the implications of a model's data lineage in AI training?,"Understanding a model's data lineage is critical as it affects compliance with licensing terms, particularly regarding whether a model can be trained on outputs from another model without violating rules.",expert,"4
Textual entailment is also known as natural language inference (NLI).
5
Anthropic has a nice tutorial on using Claude for content moderation.
6
Structured outputs are discussed in depth in Chapter 2.
7
There haven’t been many comprehensive studies of the distribution of instructions people are using
foundation models for. LMSYS published a study of one million conversations on Chatbot Arena, but
these conversations aren’t grounded in real-world applications. I’m waiting for studies from model
providers and API providers.
8
The knowledge part is tricky, as the roleplaying model shouldn’t say things that Jackie Chan doesn’t
know. For example, if Jackie Chan doesn’t speak Vietnamese, you should check that the roleplaying
model doesn’t speak Vietnamese. The “negative knowledge” check is very important for gaming. You
don’t want an NPC to accidentally give players spoilers.
9
However, the electricity cost might be different, depending on the usage.
0
Another argument for making training data public is that since models are likely trained on data
scraped from the internet, which was generated by the public, the public should have the right to
access the models’ training data.
1
In spirit, this restriction is similar to the Elastic License that forbids companies from offering the
open source version of Elastic as a hosted service and competing with the Elasticsearch platform.
2
It’s possible that a model’s output can’t be used to improve other models, even if its license allows
that. Consider model X that is trained on ChatGPT’s outputs. X might have a license that allows this,
but if ChatGPT doesn’t, then X violated ChatGPT’s terms of use, and therefore, X can’t be used. This
is why knowing a model’s data lineage is so important.
3
For example, as of this writing, you can access GPT-4 models only via OpenAI or Azure. Some
might argue that being able to provide services on top of OpenAI’s proprietary models is a key",73a9fbe8
best practices for reporting model performance,"The chapter emphasizes the importance of disclosing the percentage of benchmark data used in training when reporting model performance, along with results on overall and clean samples of the benchmark.",expert,"The n-gram overlapping approach is more accurate but can be time-
consuming and expensive to run because you have to compare each
benchmark example with the entire training data. It’s also impossible
without access to the training data. The perplexity approach is less accurate
but much less resource-intensive.
In the past, ML textbooks advised removing evaluation samples from the
training data. The goal is to keep evaluation benchmarks standardized so
that we can compare different models. However, with foundation models,
most people don’t have control over training data. Even if we have control
over training data, we might not want to remove all benchmark data from
the training data, because high-quality benchmark data can help improve
the overall model performance. Besides, there will always be benchmarks
created after models are trained, so there will always be contaminated
evaluation samples.
For model developers, a common practice is to remove benchmarks they
care about from their training data before training their models. Ideally,
when reporting your model performance on a benchmark, it’s helpful to
disclose what percentage of this benchmark data is in your training data,
and what the model’s performance is on both the overall benchmark and the
clean samples of the benchmark. Sadly, because detecting and removing
contamination takes effort, many people find it easier to just skip it.",3ea54e1e
advanced techniques for evaluating LLMs,"The text suggests using diverse evaluation criteria, including out-of-scope inputs and error-prone examples, to rigorously assess the robustness and reliability of large language models.",expert,"outperforms model B on each subgroup but underperforms model B
overall.
a
Table 4-6. An example of Simpson’s paradox.
Group 1 Group 2 Overall
Model A 93% (81/87) 73% (192/263) 78% (273/350)
Model B 87% (234/270) 69% (55/80) 83% (289/350)
a
I also used this example in Designing Machine Learning Systems. Numbers from Charig
et al., “Comparison of Treatment of Renal Calculi by Open Surgery, Percutaneous
Nephrolithotomy, and Extracorporeal Shockwave Lithotripsy”, British Medical Journal
(Clinical Research Edition) 292, no. 6524 (March 1986): 879–82.
You should have multiple evaluation sets to represent different data slices.
You should have one set that represents the distribution of the actual
production data to estimate how the system does overall. You can slice your
data based on tiers (paying users versus free users), traffic sources (mobile
versus web), usage, and more. You can have a set consisting of the
examples for which the system is known to frequently make mistakes. You
can have a set of examples where users frequently make mistakes—if typos
are common in production, you should have evaluation examples that
contain typos. You might want an out-of-scope evaluation set, inputs your
application isn’t supposed to engage with, to make sure that your
application handles them appropriately.",6ec99943
how to evaluate AI applications,"The chapter highlights the importance of establishing specific evaluation criteria for AI applications, focusing on domain-specific capability, generation capability, instruction-following capability, and cost and latency to guide effective evaluations.",beginner,"I believe that evaluation is the biggest bottleneck to AI adoption. Being able
to build reliable evaluation pipelines will unlock many new applications.
An AI application, therefore, should start with a list of evaluation criteria
specific to the application. In general, you can think of criteria in the
following buckets: domain-specific capability, generation capability,
instruction-following capability, and cost and latency.
Imagine you ask a model to summarize a legal contract. At a high level,
domain-specific capability metrics tell you how good the model is at
understanding legal contracts. Generation capability metrics measure how
coherent or faithful the summary is. Instruction-following capability
determines whether the summary is in the requested format, such as
meeting your length constraints. Cost and latency metrics tell you how
much this summary will cost you and how long you will have to wait for it.
The last chapter started with an evaluation approach and discussed what
criteria a given approach can evaluate. This section takes a different angle:
given a criterion, what approaches can you use to evaluate it?
Domain-Specific Capability
To build a coding agent, you need a model that can write code. To build an
application to translate from Latin to English, you need a model that
understands both Latin and English. Coding and English–Latin",78bcd27e
mean win rate in model evaluation,"The chapter introduces the concept of mean win rate as an alternative to average scoring, focusing on a model's performance relative to others across different scenarios, which can offer a clearer assessment of capability.",intermediate,"treating all benchmark scores equally, i.e., treating an 80% score on
TruthfulQA the same as an 80% score on GSM-8K, even if an 80% score
on TruthfulQA might be much harder to achieve than an 80% score on
GSM-8K. This also means giving all benchmarks the same weight, even if,
for some tasks, truthfulness might weigh a lot more than being able to solve
grade school math problems.
HELM authors, on the other hand, decided to shun averaging in favor of
mean win rate, which they defined as “the fraction of times a model obtains
a better score than another model, averaged across scenarios”.
While public leaderboards are useful to get a sense of models’ broad
performance, it’s important to understand what capabilities a leaderboard is
trying to capture. A model that ranks high on a public leaderboard will
likely, but far from always, perform well for your application. If you want a
model for code generation, a public leaderboard that doesn’t include a code
generation benchmark might not help you as much.
Custom leaderboards with public benchmarks
When evaluating models for a specific application, you’re basically creating
a private leaderboard that ranks models based on your evaluation criteria.
The first step is to gather a list of benchmarks that evaluate the capabilities
important to your application. If you want to build a coding agent, look at
code-related benchmarks. If you build a writing assistant, look into creative",b73ca037
costs of hosting AI models,"The chapter outlines the costs associated with self-hosting models, highlighting the time, talent, and engineering effort required, which can be alleviated by using model hosting services.",beginner,"Using model APIs Self-hosting models
evaluation, and
interpretability
Cost
API cost Talent, time, engineering
effort to optimize, host,
maintain (can be
mitigated by using model
hosting services)
Finetuning
Can only finetune Can finetune, quantize,
models that model and optimize models (if
providers let you their licenses allow), but
it can be hard to do so
Control,
Rate limits Easier to inspect changes
access, and
Risk of losing access in open source models
transparency
to the model You can freeze a model
Lack of transparency to maintain its access, but
in model changes and you’re responsible for
versioning",8aeabb11
best practices for evaluating AI models,The chapter outlines an iterative evaluation workflow that helps teams determine whether to use model APIs or self-hosted models based on performance needs.,beginner,"Figure 4-5. An overview of the evaluation workflow to evaluate models for your application.
These four steps are iterative—you might want to change the decision from
a previous step with newer information from the current step. For example,
you might initially want to host open source models. However, after public
and private evaluation, you might realize that open source models can’t
achieve the level of performance you want and have to switch to
commercial APIs.
Chapter 10 discusses monitoring and collecting user feedback. The rest of
this chapter will discuss the first three steps. First, let’s discuss a question
that most teams will visit more than once: to use model APIs or to host
models themselves. We’ll then continue to how to navigate the dizzying
number of public benchmarks and why you can’t trust them. This will set
the stage for the last section in the chapter. Because public benchmarks",91f34b96
what are essential functionalities for AI models?,"The chapter outlines key functionalities like scalability, function calling, structured outputs, and output guardrails as crucial for AI models to function effectively in real-world applications.",beginner,"Functionality
Many functionalities are needed around a model to make it work for a use
case. Here are some examples of these functionalities:
Scalability: making sure the inference service can support your
application’s traffic while maintaining the desirable latency and cost.
Function calling: giving the model the ability to use external tools, which
is essential for RAG and agentic use cases, as discussed in Chapter 6.
Structured outputs, such as asking models to generate outputs in JSON
format.
Output guardrails: mitigating risks in the generated responses, such as
making sure the responses aren’t racist or sexist.
Many of these functionalities are challenging and time-consuming to
implement, which makes many companies turn to API providers that
provide the functionalities they want out of the box.
The downside of using a model API is that you’re restricted to the
functionalities that the API provides. A functionality that many use cases
need is logprobs, which are very useful for classification tasks, evaluation,
and interpretability. However, commercial model providers might be
hesitant to expose logprobs for fear of others using logprobs to replicate
their models. In fact, many model APIs don’t expose logprobs or expose
only limited logprobs.",f5e81205
how to rank LLMs based on role performance,"The chapter provides a methodology for assessing LLMs by creating and comparing their outputs against defined role characteristics and quality criteria, using Python for organization.",beginner,"System Instruction:
You are a role−playing performance comparison
assistant. You should rank the models based on
the role characteristics and text quality of
their responses. The rankings are then output
using Python dictionaries and lists.
User Prompt:
The models below are to play the role of
‘‘{role_name}’’. The role description of
‘‘{role_name}’’ is
‘‘{role_description_and_catchphrases}’’. I
need to rank the following models based on the
two criteria below:
1. Which one has more pronounced role speaking
style, and speaks more in line with the role
description. The more distinctive the speaking
style, the better.
2. Which one’s output contains more knowledge
and memories related to the role; the richer,
the better. (If the question contains
reference answers, then the role−specific",d3c487f4
best practices for collecting user feedback on AI performance,"The text suggests considering user feedback as an essential evaluation method, correlating it with other metrics, and utilizing it actively during production for continuous improvement.",expert,"Use automatic metrics as much as possible, but don’t be afraid to fall back
on human evaluation, even in production. Having human experts manually
evaluate a model’s quality is a long-standing practice in AI. Given the
challenges of evaluating open-ended responses, many teams are looking at
human evaluation as the North Star metric to guide their application
development. Each day, you can use human experts to evaluate a subset of
your application’s outputs that day to detect any changes in the application’s
performance or unusual patterns in usage. For example, LinkedIn developed
a process to manually evaluate up to 500 daily conservations with their AI
systems.
Consider evaluation methods to be used not just during experimentation but
also during production. During experimentation, you might have reference
data to compare your application’s outputs to, whereas, in production,
reference data might not be immediately available. However, in production,
you have actual users. Think about what kinds of feedback you want from
users, how user feedback correlates to other evaluation metrics, and how to
use user feedback to improve your application. How to collect user
feedback is discussed in Chapter 10.
Annotate evaluation data
Curate a set of annotated examples to evaluate your application. You need
annotated data to evaluate each of your system’s components and each
criterion, for both turn-based and task-based evaluation. Use actual",d1eb205d
